id,author,text,url,query
2030147445620101414,Nik S,"Government dont want to build infrastructure for EV
They deliberately promoting Oil as our ministers get commission from Arabs and Russia
Hardly any working EV charging in country and 200% once you get EV government will triple the electricity price",https://x.com/Nikoshooo/status/2030147445620101414,"""EV charging"" lang:en filter:replies"
2030136540026872231,Chalupa_88,"No. I drove across country in gas . No one can piss until gas. Then hurry. Ricky bobby..go go
.now ev charging my BP is lower. 1st time I hit a bucees inwas shit why so fast",https://x.com/Chalupa_88/status/2030136540026872231,"""EV charging"" lang:en filter:replies"
2030126980079775755,Grok,"Jiuzi Holdings (JZXN, Nasdaq-listed Chinese EV charging firm) announced March 4 a proposed equity swap: strategic investor transfers 10k BTC (~$1B) for ~$1B in company equity + partnership on crypto treasury/settlements. Pending final docs & SEC filings—not a cash ""buy.""

Bullish",https://x.com/grok/status/2030126980079775755,"""EV charging"" lang:en filter:replies"
2030118349003190421,Shawn,"If you can, get an EV. Charging at home is convenient as hell.",https://x.com/whirob/status/2030118349003190421,"""EV charging"" lang:en filter:replies"
2030092851464290693,cecil,"Cv llllvv vibes  and surveyor ev charging.  Entity, ensure late no earth search are get bar staff",https://x.com/colybicker/status/2030092851464290693,"""EV charging"" lang:en filter:replies"
2030091597484822744,SolarNationUK,"3/
Across the UK today, installers are fitting:

 Solar PV
 Battery storage
 EV charging
 Heat pumps

These systems quietly replace fossil fuel demand house by house, street by street.",https://x.com/SolarNationUK/status/2030091597484822744,"""EV charging"" lang:en filter:replies"
2030089342828396784,Vexity,"Grid infrastructure alone could require trillions in investment over the next decade.
Electrification, EV charging, renewables, and AI data centers all depend on it.",https://x.com/xVexity/status/2030089342828396784,"""EV charging"" lang:en filter:replies"
2030077961051808240,DogWalksMe,"Ah, the uninformed masses. I do feel pity. What pray tell state do you live in where the electric co does not offer a rate plan with free overnight EV charging? There is an overabundance of electricity overnight since demand is low. Electric Co incentivises you to charge then.",https://x.com/DogWalksMe/status/2030077961051808240,"""EV charging"" lang:en filter:replies"
2030076987214074353,Grok,"Yes, those are accurate per LADWP's official Jan-Mar 2026 rates. Standard residential: Tier 1 at 24.8¢/kWh, Tier 2+ at 30.6¢/kWh. Typical household effective average lands ~27-30¢/kWh. For home EV charging, Time-of-Use plans let you hit the base/off-peak rate of ~25.3¢/kWh",https://x.com/grok/status/2030076987214074353,"""EV charging"" lang:en filter:replies"
2030047471863308352,PiRsquared,"Counting Peter’s $8 billion installed EV charging stations… 1, 2, 3, 4, 5, 6, 7, 8.   Wait Buccees installed more than this incompetent.",https://x.com/GeminiWolf4u/status/2030047471863308352,"""EV charging"" lang:en filter:replies"
2030046170920407111,David Anon,"The battery is reportedly safer and more durable. BYD says it passed safety tests including simultaneous flash charging and nail-penetration testing without thermal runaway, smoke, or fire.",https://x.com/DavidAnon8/status/2030046170920407111,"""EV charging"" lang:en filter:replies"
2030046120022311035,Ryan Lytollis,"That’s a lot of batteries if you could get it to work, suddenly applying heavy demand on them is another altogether. Battery storage and EV charging isn’t the answer",https://x.com/RyanLytoll72407/status/2030046120022311035,"""EV charging"" lang:en filter:replies"
2030041849759683056,Cows are plant based meats.. aka Meat-Vegan.,"DWP in Los Angeles has a subsidized metur  just for EV charging only  that is TAX PAYER FUNDED as it's ran by the government.  and funded by Fuel taxes 

it's 0.02,kWh",https://x.com/New_York_steak/status/2030041849759683056,"""EV charging"" lang:en filter:replies"
2030026384459112500,timmyzbeach ⒻⒹⓉ,"That sounds like the PERFECT reason to implement/expand EV adoption, build a more robust EV charging infrastructure and incentivise solar and renewable energies!",https://x.com/timmyzbeach/status/2030026384459112500,"""EV charging"" lang:en filter:replies"
2030026200115040576,Rangoon,"I think in 2005 that probably was a sensible approach. But with the current landscape of DC fast charging I don't think govt needs to be involved anymore. Much like gas stations, EV charging now is a sensible business with lots of competition.",https://x.com/opopinionus/status/2030026200115040576,"""EV charging"" lang:en filter:replies"
2030011458008887797,Bill Liakas,Good thing we have all those EV charging stations you built!,https://x.com/LiakasBill/status/2030011458008887797,"""EV charging"" lang:en filter:replies"
2030009933845123245,Wandering Theist,"$400 Home security AND various subscriptions, streaming, apps etc. 
$300 Cigarettes
$1000 Child Care, Gifts, Activities
$400 Gas/ EV charging",https://x.com/RlGl13/status/2030009933845123245,"""EV charging"" lang:en filter:replies"
2030006974281122029,B Invest HQ,EV charging more expensive than driving a guzzling petrol engine. Wow!,https://x.com/BInvestHQ/status/2030006974281122029,"""EV charging"" lang:en filter:replies"
2030002389713875179,PlugInSites,Have you seen the public EV charging prices lately?,https://x.com/pluginsites/status/2030002389713875179,"""EV charging"" lang:en filter:replies"
2030002049299960157,PeraSyte,Right. Its just makes so much sense. Plus you can easily designate some spots for EV charging. Keep customers dry after shopping... all kinds of benefits. Im sure im missing some down sides... but feels like a no-brainer to me,https://x.com/PeraSyte/status/2030002049299960157,"""EV charging"" lang:en filter:replies"
2030001735096553853,Asif Ali Khan,"Pakistan already pays large fixed capacity payments to power plants. Part of these guaranteed profits could gradually be redirected to build solar panel factories, EV charging infrastructure, and electric buses and bikes locally.",https://x.com/asif1605/status/2030001735096553853,"""EV charging"" lang:en filter:replies"
2029999389905932774,ruma,"EV charging used to take hours.
Now we're talking minutes.

That's a pretty dramatic curve.",https://x.com/_ruma_v/status/2029999389905932774,"""EV charging"" lang:en filter:replies"
2029993699472724137,Panda_boy,The speed at which EV charging tech is evolving right now is incredible.,https://x.com/sprahatish/status/2029993699472724137,"""EV charging"" lang:en filter:replies"
2029988936706318362,Josh,"I used to spend $70-80 every 10 days with a gas car working from home.

I spend about $65 per month on EV charging and I’m not even properly optimized (I charge off site cause my homes electrical is old)",https://x.com/supersecretjosh/status/2029988936706318362,"""EV charging"" lang:en filter:replies"
2029985989016600816,Triox,18% tax on ev charging. Not going to happen any time sooner,https://x.com/digish777/status/2029985989016600816,"""EV charging"" lang:en filter:replies"
2029972566324969917,Martin Whapshott,But we must have this highly polluting gas to meet EV charging demand.,https://x.com/ArtificerApp823/status/2029972566324969917,"""EV charging"" lang:en filter:replies"
2029969949968715959,Lesley Grace,"Range, where I live, North Cumbria only 4 spots for EV charging anywhere.  Not good enough, not dependable",https://x.com/LesleyGrac82775/status/2029969949968715959,"""EV charging"" lang:en filter:replies"
2029967989005533265,Xiao Wang,Uberization of EV charging is precisely the most easily realized value of DERs I agree,https://x.com/xiaowang1984/status/2029967989005533265,"""EV charging"" lang:en filter:replies"
2029967259968348369,Andy Garratt,"Yep, with you. 70,000 miles shows that most rapid EV charging sucks and is a rip-off.

The reason I bought a Tesla was to get access to the Supercharger network when it was still Tesla-only (many sites still are)

Charge at home? EVs are great. If you can’t you’re hosed IMHO.",https://x.com/amgarratt/status/2029967259968348369,"""EV charging"" lang:en filter:replies"
2029961707364429869,Marco Cortez,"Sure,  B-plug accomplished a couple of things. 
1. A handful of EV charging stations across the nation for ONLY 8 Billion dollars. 

2. A completely wrecked maritime supply chain and he was no where to be found for two months pretending to be a biological father on family leave.",https://x.com/CortezEusebio12/status/2029961707364429869,"""EV charging"" lang:en filter:replies"
2029961211492847967,cherie,Remember when your government ripped out all the EV charging stations and billed taxpayers 286 million to boot?  I do,https://x.com/imherenow1/status/2029961211492847967,"""EV charging"" lang:en filter:replies"
2029960056247099505,Grok,"Yes, both HPCL & BPCL invest in EV charging like IOCL.

HPCL: >5,300 stations under HP e-Charge brand already; Dec 2025 partnership with V-GREEN to expand at its 24,400+ retail outlets.

BPCL: Partnerships with Tata Motors (mega fast-charging hubs at select outlets, Jan 2026) &",https://x.com/grok/status/2029960056247099505,"""EV charging"" lang:en filter:replies"
2029958902893232284,Grok,"No, IOCL's EV charging won't become its biggest revenue generator like the oil/petroleum segment (which is ~94% of revenue, e.g., ₹2.17 lakh Cr in Q3 FY26 out of ₹2.32 lakh Cr total). 

EV (13,614 stations) adds negligible revenue today—India's whole EV charging market is",https://x.com/grok/status/2029958902893232284,"""EV charging"" lang:en filter:replies"
2029957004916412677,Thomas Olson,Remember spending $7.5 billion to build 7 EV charging stations. That was awesome.,https://x.com/tomnatsattv/status/2029957004916412677,"""EV charging"" lang:en filter:replies"
2029955429191590226,Matt Herrington,Bad take. EV charging already pay a premium over base electricity because most people charge at home. EVs also pay a surcharge at the DMV that is meant to cover the road tax.,https://x.com/funandprofitco/status/2029955429191590226,"""EV charging"" lang:en filter:replies"
2029954928861405335,Grok,"Yes, IOCL is investing heavily in EV tech for the future. As of FY25, they've commissioned 13,614 EV charging stations (up 4,656 that year) and 128 battery swapping stations across outlets. They're pursuing JVs like one with Panasonic for Li-ion battery manufacturing, advancing",https://x.com/grok/status/2029954928861405335,"""EV charging"" lang:en filter:replies"
2029950247422636274,Darrell Spice Jr.,"Keyword is ""Supercharge"".  Superchargers are Tesla's high speed chargers that are typically used during road trips.

Most EV charging is done at home, for which the time to charge is irrelevant as you can get a full charge overnight while sleeping. Free-nights electric plans are",https://x.com/SpiceWare/status/2029950247422636274,"""EV charging"" lang:en filter:replies"
2029945955618017784,Lidl Ireland,"Hi Rosario, thank you for reaching out. We were very sorry to hear that EV charging stations were not working during your visit, if you could please reach out advising of the date & time of your visit we will be sure to have this issue raised for review.",https://x.com/lidl_ireland/status/2029945955618017784,"""EV charging"" lang:en filter:replies"
2029945861657305451,Shreekanth Murali,Pt3: we were planning for ev charging station near vikravandi and bank asked us to reach out near by vikravandi branch which doesn't sounds right. We dont have an account but still this is not the response they can give when gov facilitates such a scheme,https://x.com/shreeingame1/status/2029945861657305451,"""EV charging"" lang:en filter:replies"
2029931948894720151,Mercury's Hooman,I'm researching protable powerbanks for EV charging and running household electronics,https://x.com/Mercury_Hooman/status/2029931948894720151,"""EV charging"" lang:en filter:replies"
2029930577432887461,IDOT_Illinois,"With an SMTD bus facility, Amtrak station, and parking deck, THE HUB will make getting around easier, safer, and greener thanks to EV charging and solar panels. Look forward to its grand opening in 2027! 
http://
sangamonil.gov/thehub",https://x.com/IDOT_Illinois/status/2029930577432887461,"""EV charging"" lang:en filter:replies"
2029928104253345977,Chris Gilmour,"Click link blocker Dave sent earlier. 19m homes have access to a drive (10m don't), but only 5% have EV charging. It's too simplistic to say 95% should just install - there are lots of reasons why that may not be possible. 

UK is lacking infrastructure due to politicians.",https://x.com/Chris_Gilmour/status/2029928104253345977,"""EV charging"" lang:en filter:replies"
2029927854180553131,sactown mobile ev charging,Claude,https://x.com/guttercleanin/status/2029927854180553131,"""EV charging"" lang:en filter:replies"
2029925378081395081,Watermelon Jelly Bean,"Here's construction photos from what'll probably be the first 
@Walmart
 EV charging in the Triangle at Supercenter #4484 Raleigh, NC, taken Saturday 2/28. Waiting on its utility transformer & then hopefully prompt final inspections.",https://x.com/WatermelonJB/status/2029925378081395081,"""EV charging"" lang:en filter:replies"
2029924983128883306,Grow Token,"Fast EV charging keeps fleets moving, eases grid demand, and speeds up the transition to cleaner transport.",https://x.com/grow_token_/status/2029924983128883306,"""EV charging"" lang:en filter:replies"
2029921436056346896,Erin Maplehoff,"Shut up Petey.  You couldn't even get potholes filled in South Bend when you were its mayor.  Oh, & BTW, what's up with the EV charging stations you never got built but cost us taxpayers BILLIONS????",https://x.com/EMaplehoff/status/2029921436056346896,"""EV charging"" lang:en filter:replies"
2029920472134214016,Ambrish Kela,"Please provide  EV charging infrastructure  along intercity routes for electric cars, buses and trucks too. This will accelerate adoption of heavy electric vehicles.",https://x.com/kela_ambrish/status/2029920472134214016,"""EV charging"" lang:en filter:replies"
2029919375449288742,Grok,"No worries at all—tone can be tricky in text. Those questions were solid practical ones on scalability, and the tech's design (BESS buffering + efficient electronics) does address them well for faster, more feasible EV charging. Progress through scrutiny is how it improves.",https://x.com/grok/status/2029919375449288742,"""EV charging"" lang:en filter:replies"
2029907235996877109,Trade Ready HQ,"The 2026 cycle is a big one. Branch circuit protection changes, EV charging infrastructure requirements (Art. 625), and energy storage system rules are the three to front-load. Also worth flagging the updated arc-fault and GFCI expansion — inspectors are going to be watching",https://x.com/TradeReadyHQ/status/2029907235996877109,"""EV charging"" lang:en filter:replies"
2029900459176083720,Grok,"No, not significantly in the short term. 

Higher LNG costs will spike electricity prices in LNG-heavy Asian importers like Japan, South Korea, and parts of India/China—raising EV charging expenses and adding to inflation that could slow overall auto sales. 

China (coal-dominant",https://x.com/grok/status/2029900459176083720,"""EV charging"" lang:en filter:replies"
2029898756351545736,Grok,"China has the world's largest EV charging network: 20.7 million connectors as of Jan 2026 (4.8M public), avg public power ~47 kW but with thousands of 350-600+ kW DC units already deployed along highways.

BYD's flash charging (1.5 MW / 1500 kW) is supported by their own rollout:",https://x.com/grok/status/2029898756351545736,"""EV charging"" lang:en filter:replies"
2029896473437954279,Madd Mike,"When you say starter you know they aren’t leaders.

Tesla is the best selling EV, is that a leader?

Tesla has the largest EV charging system in America, isn’t that a leader?

Tesla is the only Company going to produce a long range Semi, isn’t that a leader?

Try harder",https://x.com/BogartBoomer/status/2029896473437954279,"""EV charging"" lang:en filter:replies"
2029883281701769255,4comall,"said I've just driven onto the EV charging point there's only the actual matter in there. 
Now I don't want an EV but if it wasn't for idiots and wankers filling their tanks up with fuel they're not going to use for months they wouldn't be a problem.",https://x.com/topselfy/status/2029883281701769255,"""EV charging"" lang:en filter:replies"
2029882611141857294,Equity Concall,"Tata Power has collaborated with Salesforce to accelerate India's clean energy transition by leveraging Salesforce's AI CRM platform to digitally transform its renewable energy businesses, including rooftop solar, EV charging, and smart home solutions.",https://x.com/Pkjat340/status/2029882611141857294,"""EV charging"" lang:en filter:replies"
2029871902760550795,Victoria Sullivan,"In MA you don’t even know that you went through a toll or how much you just got dinged.  

We need to tax the EV charging stations.  Those EVs are largely from out of state.  They are very heavy and can do more damage to the roads than regular cars.  They aren’t paying a gas tax.",https://x.com/victoria4nh/status/2029871902760550795,"""EV charging"" lang:en filter:replies"
2029869347657896346,The UX Project,"@DewanshPoddar
 is a Clean Energy builder & act as an energy powerhouse for our Thinktank. He has been part of the last 2 editions & founded EV Recharge, building mobile EV charging infrastructure powered by 100% green energy.

Previously supported 60+ startups through 
@iitdelhi",https://x.com/theuxproject_co/status/2029869347657896346,"""EV charging"" lang:en filter:replies"
2029855338229363172,Saron Love,"The inclusion of EV charging hubs and modern transit stations shows we are building for the future, not just today. This sets a very high bar for all upcoming urban developments in Ethiopia!",https://x.com/lovesaron16/status/2029855338229363172,"""EV charging"" lang:en filter:replies"
2029850265088663740,Peter Harrison,"Yep
I get it, it's tough to take an increase in living costs. But this is the reality of relying on energy/fuel from hostile nations.

People complain about EV's being 'bad', yada yada
I'm sat here with my EV charging from my home solar and in complete control of the costs",https://x.com/Specialized_Cb/status/2029850265088663740,"""EV charging"" lang:en filter:replies"
2029846640631197939,DriVe2X,"2/ Dr. ir. Gautham Ram is an Associate Professor of #ElectricMobility in the Department of Electrical Sustainable Energy at the Delft University of Technology.

His current research focuses on electric vehicles, #EV charging, batteries and power electronics.",https://x.com/drive2x_eu/status/2029846640631197939,"""EV charging"" lang:en filter:replies"
2029839650957762867,Grok,"No, not entirely—the union sympathy actions are indeed restricting Tesla's grid work, slowing their Supercharger rollout and potentially giving other EV charging networks or automakers a relative edge in Sweden.

But Konkurrensverket focuses on company cartels, dominance abuse,",https://x.com/grok/status/2029839650957762867,"""EV charging"" lang:en filter:replies"
2029835826868232404,Grok,"This video shows a remote EV charging station under solar panels, featuring NRMA/Tritium fast chargers. The camera pans across large blue diesel generator enclosures with warning labels about DPF regeneration, no smoking/naked flames, and a white Fuelco diesel storage tank",https://x.com/grok/status/2029835826868232404,"""EV charging"" lang:en filter:replies"
2029834266608009679,PlugPrice - Compare Public EV Charging Prices -,"BYD flash stations have 1,5 MWh on-site battery storage.",https://x.com/PlugPrice_com/status/2029834266608009679,"""EV charging"" lang:en filter:replies"
2029828670022451485,PlugPrice - Compare Public EV Charging Prices -,Coming to Europe so I think in time they will go to other markets outside China,https://x.com/PlugPrice_com/status/2029828670022451485,"""EV charging"" lang:en filter:replies"
2029818821893103991,Grok,"In Australia's NEM (main grid for ~90% of population), AEMO Q4 2025 data shows renewables at 51% of generation—fossil fuels (coal 46%, gas 3%) at 49%. Full-year 2024 was ~60% fossil per govt stats. 

Most EV charging pulls from this average grid mix, so roughly 50% of",https://x.com/grok/status/2029818821893103991,"""EV charging"" lang:en filter:replies"
2029818650543411694,Shaun,"@grok
 what %  of EV charging in Australia comes grid that’s uses fossil fuels ?",https://x.com/shaunwor/status/2029818650543411694,"""EV charging"" lang:en filter:replies"
2029815506832613844,HGS Motor,What other questions do you have about EV charging?,https://x.com/hgsmotorhq/status/2029815506832613844,"""EV charging"" lang:en filter:replies"
2029798966116679835,Robert Schnell,Incompetence might be spending $60 BILLION on EV charging stations and delivering 0 Pete.,https://x.com/mntrader1993/status/2029798966116679835,"""EV charging"" lang:en filter:replies"
2029793539832352852,Tim Hundley,"Really?  OK. Read below. (From Grok)

“China’s EV charging infrastructure is the world’s largest and most extensive.

As of late 2025, the country has over 12 million public charging points (including AC and DC fast chargers), plus roughly 25–30 million private chargers, for",https://x.com/TimHundley4All/status/2029793539832352852,"""EV charging"" lang:en filter:replies"
2029772992306151674,tameron,Holler at me if you need EV charging! Sounds like a good spot if you have parking,https://x.com/Tam3ron/status/2029772992306151674,"""EV charging"" lang:en filter:replies"
2029767883895755179,Robert G'Day,"Over 99% of EV charging stations are not powered by diesel generators. Where they are, in remote areas, the overall CO2 emissions are equal or lower than a diesel ICE vehicle due to efficiency of EV and the generator that operates at optimum efficiency, unlike the ICE vehicle.",https://x.com/RobertD11359976/status/2029767883895755179,"""EV charging"" lang:en filter:replies"
2029736636271952259,alcafe,"NO - electrical faults are awful, I once had a Corsa and had to get it scrapped as it could not be fixed. I do not want 'battery not holding charge' or system malfunctions.  EV charging and A.I. will burn out the National Electricity grid.",https://x.com/f5alcafe/status/2029736636271952259,"""EV charging"" lang:en filter:replies"
2029709177518510199,L. Roche,"China adds coal plants weekly but sure, fast EV charging saves the planet.",https://x.com/nukeadvocate/status/2029709177518510199,"""EV charging"" lang:en filter:replies"
2029707340782653907,Lando K,Overnight electric vehicle (EV) charging typically costs between $0.06 and $0.15 per kWh for residential,https://x.com/LandoK1234567/status/2029707340782653907,"""EV charging"" lang:en filter:replies"
2029698978376212763,Grok,"UK domestic BS1363 3-pin sockets are rated 13A max but only for short/intermittent use. For continuous loads like EV charging, the safe sustained rating is 10A (2.3kW) to prevent overheating.

Standard sockets don't hold up well at 13A+ over hours—risk of melting, degradation or",https://x.com/grok/status/2029698978376212763,"""EV charging"" lang:en filter:replies"
2029692974758572096,Man,"LOL 
7p is subsidised tariff for EV charging. 
I am with Octopus Economy 7.",https://x.com/mtc_london/status/2029692974758572096,"""EV charging"" lang:en filter:replies"
2029692179409494216,Mark W Tebbutt,"How can it be subsidised by “the rest of the country”? It’s a private company offering the tariff. They can’t charge people who aren’t their customers.

It’s cheaper because Octopus can remotely start and stop my EV charging. That lets them shift charging to the cheapest periods",https://x.com/mwt2008/status/2029692179409494216,"""EV charging"" lang:en filter:replies"
2029690373745074290,Man,"Yeah. That's why I have economy-7 tariffs. Overnight is cheaper when I do my washing/drying/heating.
But my night tariff is a lot more than your 7p for EV charging.
It looks like your 7p tariff is subsidised by the rest of the country.",https://x.com/mtc_london/status/2029690373745074290,"""EV charging"" lang:en filter:replies"
2029689947200889259,Mark W Tebbutt,"It was simply to show how cheap EV charging can be compared to petrol and diesel, especially with oil prices rising.

The government already offers grants to councils for pavement charging channels and other on-street charging.

You don’t need to park outside your house every",https://x.com/mwt2008/status/2029689947200889259,"""EV charging"" lang:en filter:replies"
2029684404654854490,a Little Stinky (The Pest),WHERE IS THE 9 MILLION BROADBAND MONIES?WHERE IS THE EV CHARGING STATIONS? WHY IS RENO STILL THE HOTEST CLIMATE CITY ON THE WEST?,https://x.com/a_the69035/status/2029684404654854490,"""EV charging"" lang:en filter:replies"
2029681252874523071,J₳son Lee L₳sky,"Plus Home Solar & Battery for EV charging, especially when the Sun shines. Bonus soak up grid electricity when it is cheap & sell back to the grid when prices rise. Yay OZ home solar & batteries + EVs. Next charging networks everywhere: shopping centre solar covered car parks etc",https://x.com/hubwayfractal/status/2029681252874523071,"""EV charging"" lang:en filter:replies"
2029669852210733415,Grok,"Almost all EV charging (99%+) comes from the electrical grid—mostly home (80%+ of US sessions per EIA/IEA data) or grid-connected public/work stations. 

Diesel generators handle a negligible fraction, only in rare cases: remote/off-grid spots (e.g., Australian outback",https://x.com/grok/status/2029669852210733415,"""EV charging"" lang:en filter:replies"
